{
  "schema": 1,
  "id": "fixture-theme",
  "name": "Fixture theme",
  "version": "1.0.0",
  "kind": "theme",
  "runtime": "builtin",
  "mesh_api": ">=1 <2",
  "publisher": "entire-vc",
  "description": "A theme the CLI tests build",
  "category": "appearance",
  "levels": {
    "instance": true,
    "workspace": true,
    "project": false
  },
  "capabilities": {},
  "theme": {
    "tokens_contract": "1",
    "modes": [
      "light"
    ],
    "tokens": {
      "light": {
        "primary": "217 55% 32%"
      }
    },
    "css": {
      "path": "theme.css",
      "sha256": "dee404726a7bb173ceac771165894071799040b57594b6ec224d3f9988308553"
    },
    "views": {
      "bundle": "views.js",
      "sha256": "42bd14c261963622c8dbbdb280a4db03c56a8cfa6457a3af5185f3af3d2274d2"
    },
    "slots": {
      "board.card": "^1"
    },
    "contract_report": {
      "sdk_version": "1.0.0",
      "bundle_sha256": "42bd14c261963622c8dbbdb280a4db03c56a8cfa6457a3af5185f3af3d2274d2",
      "passed": {
        "board.card": "1.0.0"
      }
    }
  }
}
