{
  "schema": 1,
  "id": "gitlab",
  "name": "GitLab",
  "version": "1.0.0",
  "kind": "integration",
  "runtime": "builtin",
  "mesh_api": ">=1 <2",
  "publisher": "entire-vc",
  "description": "Links GitLab merge requests to tasks: webhook, MR and pipeline status",
  "category": "development",
  "tags": [
    "vcs"
  ],
  "license": "Apache-2.0",
  "repository": "https://github.com/entire-vc/evc-mesh",
  "levels": {
    "instance": true,
    "workspace": true,
    "project": true
  },
  "settings": {
    "instance": {
      "$ref": "#/schemas/connection"
    },
    "workspace": {
      "$ref": "#/schemas/connection"
    },
    "project": {
      "type": "object",
      "properties": {
        "repo_path": {
          "type": "string",
          "title": "Project path (group/project)",
          "title_i18n": { "ru": "Путь проекта (group/project)" }
        }
      },
      "required": [
        "repo_path"
      ]
    }
  },
  "schemas": {
    "connection": {
      "type": "object",
      "properties": {
        "base_url": {
          "type": "string",
          "format": "uri",
          "title": "GitLab URL",
          "title_i18n": { "ru": "URL GitLab" }
        },
        "token": {
          "type": "string",
          "title": "Token",
          "title_i18n": { "ru": "Токен" },
          "x-secret": true
        },
        "webhook_secret": {
          "type": "string",
          "title": "Webhook secret",
          "title_i18n": { "ru": "Секрет вебхука" },
          "x-secret": true
        }
      }
    }
  },
  "capabilities": {
    "api": [
      "tasks:read",
      "tasks:write",
      "vcs_links:write"
    ],
    "events": [],
    "webhooks_in": [
      "gitlab"
    ],
    "network": {
      "allowed_domains": [
        "{settings.base_url}"
      ],
      "reasoning": "MR and pipeline status check via the GitLab instance API"
    },
    "ui": [
      "task.panel",
      "task.badge",
      "task.actions"
    ],
    "secrets": [
      "token",
      "webhook_secret"
    ]
  }
}
